{
  "eventId":"32777777-7777-4777-8777-777777777777","eventType":"visit.checked-out","schemaVersion":1,"tenantId":"tenant-field","correlationId":"corr-m32-check-out","causationId":"checkout-032","aggregateType":"Visit","aggregateId":"32222222-2222-4222-8222-222222222222","aggregateVersion":2,"occurredAt":"2026-07-14T13:00:01Z",
  "payload":{"visitId":"32222222-2222-4222-8222-222222222222","appointmentId":"32333333-3333-4333-8333-333333333333","projectId":"32444444-4444-4444-8444-444444444444","workOrderId":"32555555-5555-4555-8555-555555555555","taskId":"32666666-6666-4666-8666-666666666666","visitSequence":1,"technicianId":"technician-032","networkId":"network-a","status":"COMPLETED","capturedAt":"2026-07-14T13:00:00Z","receivedAt":"2026-07-14T13:00:01Z","geofenceResult":"WITHIN_GEOFENCE","policyDecision":"ACCEPTED","resultCode":"SERVICE_COMPLETED","exceptionCode":null,"operationRefs":["operation://survey/1"],"evidenceRefs":[],"aggregateVersion":2,"occurredAt":"2026-07-14T13:00:01Z","eventType":"visit.checked-out"}
}
